{
  "schema": "split_manifest.v1",
  "dataset_fingerprint": "a4d96c1b35a770a5ce426a3407af4fbd728ddac9a648cdb4746e2f827f803216",
  "split_policy": {
    "method": "heldout_game",
    "heldout_fraction": 0.2,
    "min_heldout_games": 1,
    "seed": "fdm-d2e-full-v1",
    "cross_resolution_grouping": "game"
  },
  "splits": {
    "train": [
      "d2e_480p:Apex_Legends/0805_01",
      "d2e_480p:Apex_Legends/0805_02",
      "d2e_480p:Apex_Legends/0824_01",
      "d2e_480p:Apex_Legends/0825_01",
      "d2e_480p:Apex_Legends/0902_01",
      "d2e_480p:Apex_Legends/0903_01",
      "d2e_480p:Apex_Legends/0904_01",
      "d2e_480p:Apex_Legends/0904_02",
      "d2e_480p:Apex_Legends/0904_03",
      "d2e_480p:Apex_Legends/0905_05",
      "d2e_480p:Apex_Legends/0905_06",
      "d2e_480p:Apex_Legends/0906_10",
      "d2e_480p:Apex_Legends/0908_01",
      "d2e_480p:Apex_Legends/0908_02",
      "d2e_480p:Apex_Legends/0909_01",
      "d2e_480p:Apex_Legends/0909_02",
      "d2e_480p:Apex_Legends/0909_03",
      "d2e_480p:Apex_Legends/0911_01",
      "d2e_480p:Apex_Legends/apex_0731_01",
      "d2e_480p:Apex_Legends/apex_0731_02",
      "d2e_480p:Apex_Legends/apex_0809_01",
      "d2e_480p:Apex_Legends/apex_0810_01",
      "d2e_480p:Apex_Legends/apex_0810_02",
      "d2e_480p:Apex_Legends/apex_0810_03",
      "d2e_480p:Apex_Legends/apex_0810_04",
      "d2e_480p:Apex_Legends/apex_0810_05",
      "d2e_480p:Apex_Legends/apex_0810_07",
      "d2e_480p:Apex_Legends/apex_0810_08",
      "d2e_480p:Apex_Legends/apex_0811_01",
      "d2e_480p:Apex_Legends/apex_0811_02",
      "d2e_480p:Apex_Legends/apex_0813_01",
      "d2e_480p:Apex_Legends/apex_0817_01",
      "d2e_480p:Apex_Legends/apex_0817_02",
      "d2e_480p:Apex_Legends/apex_0817_03",
      "d2e_480p:Apex_Legends/apex_0817_04",
      "d2e_480p:Apex_Legends/apex_0820_01",
      "d2e_480p:Battlefield_6_Open_Beta/battlefield6beta_20250817",
      "d2e_480p:Battlefield_6_Open_Beta/battlefield6beta_20250817_1329_2",
      "d2e_480p:Battlefield_6_Open_Beta/battlefield6beta_20250817_1350_3",
      "d2e_480p:Battlefield_6_Open_Beta/battlefield6beta_20250817_1412_4",
      "d2e_480p:Battlefield_6_Open_Beta/battlefield6beta_20250817_1903_5",
      "d2e_480p:Battlefield_6_Open_Beta/battlefield6beta_20250817_2208_6",
      "d2e_480p:Battlefield_6_Open_Beta/battlefield6beta_20250817_2236_7",
      "d2e_480p:Brotato/recording_20250829_162029__8d03cf5f",
      "d2e_480p:Brotato/recording_20250829_165550__f53a313d",
      "d2e_480p:Brotato/recording_20250829_173112__a7cd6949",
      "d2e_480p:Brotato/recording_20250830_105238__577f7335",
      "d2e_480p:Brotato/recording_20250830_112700__97c3f8e0",
      "d2e_480p:Brotato/recording_20250831_001258__942965ac",
      "d2e_480p:Brotato/recording_20250831_232546__8f46fd92",
      "d2e_480p:Brotato/recording_20250901_082853__8c476546",
      "d2e_480p:Brotato/recording_20250901_085726__6b049e5b",
      "d2e_480p:Brotato/recording_20250902_111922__54f19b5e",
      "d2e_480p:Brotato/recording_20250904_132203__7d3a59fe",
      "d2e_480p:Brotato/recording_20250905_170110__ae176151",
      "d2e_480p:Brotato/recording_20250905_200921__fc649377",
      "d2e_480p:Core_Keeper/recording_20250831_203018__ea375dfc_split_00",
      "d2e_480p:Core_Keeper/recording_20250831_203018__ea375dfc_split_01",
      "d2e_480p:Core_Keeper/recording_20250831_215346__021d1fbb",
      "d2e_480p:Core_Keeper/recording_20250903_173148__8a072c49_split_00",
      "d2e_480p:Core_Keeper/recording_20250903_173148__8a072c49_split_01",
      "d2e_480p:Core_Keeper/recording_20250903_173148__8a072c49_split_02",
      "d2e_480p:Core_Keeper/recording_20250903_173148__8a072c49_split_03",
      "d2e_480p:Core_Keeper/recording_20250903_173148__8a072c49_split_04",
      "d2e_480p:Core_Keeper/recording_20250903_184654__dfd6497f_split_00",
      "d2e_480p:Core_Keeper/recording_20250903_184654__dfd6497f_split_01",
      "d2e_480p:Core_Keeper/recording_20250903_184654__dfd6497f_split_02",
      "d2e_480p:Core_Keeper/recording_20250903_201326__8c6666e7_split_00",
      "d2e_480p:Core_Keeper/recording_20250903_201326__8c6666e7_split_01",
      "d2e_480p:Core_Keeper/recording_20250903_201326__8c6666e7_split_02",
      "d2e_480p:Core_Keeper/recording_20250906_192128__6c83f4b9_split_00",
      "d2e_480p:Core_Keeper/recording_20250906_192128__6c83f4b9_split_01",
      "d2e_480p:Core_Keeper/recording_20250906_192128__6c83f4b9_split_02",
      "d2e_480p:Core_Keeper/recording_20250906_210818__4a846703_split_00",
      "d2e_480p:Core_Keeper/recording_20250906_210818__4a846703_split_01",
      "d2e_480p:Counter-Strike_2/recording_20250813_221454_Counter-Strike_2_943307d7",
      "d2e_480p:Counter-Strike_2/recording_20250813_221652_Counter-Strike_2_ec09fbed",
      "d2e_480p:Counter-Strike_2/recording_20250813_223608_Counter-Strike_2_19d72d58",
      "d2e_480p:Counter-Strike_2/recording_20250815_172156_Counter-Strike_2_3258b569",
      "d2e_480p:Counter-Strike_2/recording_20250816_001536_Counter-Strike_2_45cf102e",
      "d2e_480p:Counter-Strike_2/recording_20250816_235408_Counter-Strike_2_a5935293",
      "d2e_480p:Counter-Strike_2/recording_20250817_102950_Counter-Strike_2_7cab77fe",
      "d2e_480p:Counter-Strike_2/recording_20250820_212408_Counter-Strike_2_ea30a554",
      "d2e_480p:Counter-Strike_2/recording_20250820_223641_Counter-Strike_2_94377cfa",
      "d2e_480p:Counter-Strike_2/recording_20250822_231621_Counter-Strike_2_6d6ce3fd",
      "d2e_480p:Cyberpunk_2077/recording_20250824_171041_Cyberpunk_2077_dc922763",
      "d2e_480p:Cyberpunk_2077/recording_20250903_211126__a4117108_split_00",
      "d2e_480p:Cyberpunk_2077/recording_20250903_211126__a4117108_split_01",
      "d2e_480p:Cyberpunk_2077/recording_20250903_211126__a4117108_split_02",
      "d2e_480p:Cyberpunk_2077/recording_20250903_211126__a4117108_split_03",
      "d2e_480p:Cyberpunk_2077/recording_20250903_211126__a4117108_split_04",
      "d2e_480p:Cyberpunk_2077/recording_20250903_211126__a4117108_split_05",
      "d2e_480p:Cyberpunk_2077/recording_20250903_211126__a4117108_split_06",
      "d2e_480p:Cyberpunk_2077/recording_20250903_211126__a4117108_split_07",
      "d2e_480p:Cyberpunk_2077/recording_20250903_211126__a4117108_split_08",
      "d2e_480p:Cyberpunk_2077/recording_20250903_211126__a4117108_split_09",
      "d2e_480p:Cyberpunk_2077/recording_20250903_230107__3be557eb_split_00",
      "d2e_480p:Cyberpunk_2077/recording_20250903_230107__3be557eb_split_01",
      "d2e_480p:Cyberpunk_2077/recording_20250903_230107__3be557eb_split_02",
      "d2e_480p:Cyberpunk_2077/recording_20250903_230107__3be557eb_split_03",
      "d2e_480p:Cyberpunk_2077/recording_20250903_230107__3be557eb_split_04",
      "d2e_480p:Cyberpunk_2077/recording_20250903_230107__3be557eb_split_05",
      "d2e_480p:Cyberpunk_2077/recording_20250903_230107__3be557eb_split_06",
      "d2e_480p:Cyberpunk_2077/recording_20250903_230107__3be557eb_split_07",
      "d2e_480p:Cyberpunk_2077/recording_20250903_230107__3be557eb_split_08",
      "d2e_480p:Cyberpunk_2077/recording_20250904_030624__aba299b7_split_00",
      "d2e_480p:Cyberpunk_2077/recording_20250904_030624__aba299b7_split_01",
      "d2e_480p:Cyberpunk_2077/recording_20250904_030624__aba299b7_split_02",
      "d2e_480p:Cyberpunk_2077/recording_20250904_030624__aba299b7_split_03",
      "d2e_480p:Cyberpunk_2077/recording_20250904_030624__aba299b7_split_04",
      "d2e_480p:Cyberpunk_2077/recording_20250904_062946__c88cebf5",
      "d2e_480p:Cyberpunk_2077/recording_20250904_231832__cc7296d2",
      "d2e_480p:Cyberpunk_2077/recording_20250905_062601__63d5abd5_split_00",
      "d2e_480p:Cyberpunk_2077/recording_20250905_062601__63d5abd5_split_01",
      "d2e_480p:Cyberpunk_2077/recording_20250905_062601__63d5abd5_split_02",
      "d2e_480p:Cyberpunk_2077/recording_20250905_062601__63d5abd5_split_03",
      "d2e_480p:Cyberpunk_2077/recording_20250905_062601__63d5abd5_split_04",
      "d2e_480p:Cyberpunk_2077/recording_20250905_062601__63d5abd5_split_05",
      "d2e_480p:Dinkum/recording_20250914_125445__248fe9a9",
      "d2e_480p:Dinkum/recording_20250914_132100__d87583d4_split_00",
      "d2e_480p:Dinkum/recording_20250914_132100__d87583d4_split_01",
      "d2e_480p:Dinkum/recording_20250914_141403__588a9773_split_00",
      "d2e_480p:Dinkum/recording_20250914_141403__588a9773_split_01",
      "d2e_480p:Dinkum/recording_20250914_141403__588a9773_split_02",
      "d2e_480p:Dinkum/recording_20250914_141403__588a9773_split_03",
      "d2e_480p:Dinkum/recording_20250914_141403__588a9773_split_04",
      "d2e_480p:Dinkum/recording_20250914_141403__588a9773_split_05",
      "d2e_480p:Dinkum/recording_20250914_141403__588a9773_split_06",
      "d2e_480p:Dinkum/recording_20250914_211250__717a65d2_split_00",
      "d2e_480p:Dinkum/recording_20250914_211250__717a65d2_split_01",
      "d2e_480p:Dinkum/recording_20250914_211250__717a65d2_split_02",
      "d2e_480p:Dinkum/recording_20250914_211250__717a65d2_split_03",
      "d2e_480p:Dinkum/recording_20250914_211250__717a65d2_split_04",
      "d2e_480p:Dinkum/recording_20250914_211250__717a65d2_split_05",
      "d2e_480p:Dinkum/recording_20250915_013055__9da5a2e9_split_00",
      "d2e_480p:Dinkum/recording_20250915_013055__9da5a2e9_split_01",
      "d2e_480p:Dinkum/recording_20250915_013055__9da5a2e9_split_02",
      "d2e_480p:Dinkum/recording_20250915_013055__9da5a2e9_split_03",
      "d2e_480p:Dinkum/recording_20250915_013055__9da5a2e9_split_04",
      "d2e_480p:Dinkum/recording_20250915_013055__9da5a2e9_split_05",
      "d2e_480p:Dinkum/recording_20250915_040947__96bd8b24_split_00",
      "d2e_480p:Dinkum/recording_20250915_131724__b411324b_split_00",
      "d2e_480p:Dinkum/recording_20250915_131724__b411324b_split_01",
      "d2e_480p:Dinkum/recording_20250915_131724__b411324b_split_02",
      "d2e_480p:Dinkum/recording_20250915_142615__02c715ed_split_00",
      "d2e_480p:Dinkum/recording_20250915_142615__02c715ed_split_01",